{
  "metadata": {
    "title": "TFT Set 17 / Patch 17.1 Rebuild Pack",
    "set": 17,
    "set_name": "Space Gods",
    "patch": "17.1",
    "generated_on": "2026-04-23",
    "notes": [
      "This pack is rebuilt from current official Riot patch/set-overview data plus current Mobalytics Set 17 roster, synergy, item, and meta pages surfaced through web search.",
      "Fields that were not explicitly available in reliable snippets are omitted instead of guessed.",
      "Use this as a clean ingest baseline for /api/ingest/metatft, then enrich champion stats/ability scaling from a second-stage scraper if needed."
    ]
  },
  "systems": {
    "realm_of_the_gods": {
      "replaces": "Carousel",
      "flow": [
        "Each god round offers 2 gods plus a weaker generic Pengu option.",
        "All god offerings come with a component.",
        "If you are lower HP, Pengu offers higher-cost units and PvE gives component anvils instead of random components.",
        "At 4-7, the god you aligned with offers a Boon armory and continues dropping loot later."
      ]
    },
    "space_gods": [
      {
        "name": "Soraka",
        "title": "God of Stars",
        "focus": "HP / health preservation"
      },
      {
        "name": "Ahri",
        "title": "God of Opulence",
        "focus": "econ / gold"
      },
      {
        "name": "Aurelion Sol",
        "title": "God of Wonders",
        "focus": "quests / conditional boons"
      },
      {
        "name": "Yasuo",
        "title": "God of the Abyss",
        "focus": "hex empowerment / positioning"
      },
      {
        "name": "Varus",
        "title": "God of Love",
        "focus": "board options / unit quality"
      },
      {
        "name": "Evelynn",
        "title": "God of Temptation",
        "focus": "risk-reward trades"
      },
      {
        "name": "Thresh",
        "title": "God of Pacts",
        "focus": "random boons from other gods plus gold"
      },
      {
        "name": "Kayle",
        "title": "God of Order",
        "focus": "items"
      },
      {
        "name": "Ekko",
        "title": "God of Time",
        "focus": "past-themed rewards / artifacts / temporary effects"
      }
    ],
    "patch_17_1b_highlights": {
      "augments_removed": [
        "Golden Dragon",
        "Just Hit",
        "Max Build"
      ],
      "traits_changed": [
        {
          "name": "Mecha",
          "change": "Transformed bonus Health 50% -> 40%"
        },
        {
          "name": "Space Groove",
          "change": "Attack Speed per Groovian 12% -> 11%"
        }
      ],
      "system_changes": [
        {
          "name": "Level 7 shop odds",
          "from": "16/30/43/10/1",
          "to": "19/30/40/10/1"
        },
        {
          "name": "Stage 3-7 loot",
          "change": "Components dropped reduced by 1"
        },
        {
          "name": "Encounters",
          "change": "Not present in 17.1; planned for 17.2"
        }
      ],
      "keyword_changes": [
        {
          "from": "Chill",
          "to": "Slow"
        },
        {
          "from": "Dazzle",
          "to": "Weaken"
        },
        {
          "from": "Spells can critically strike",
          "to": "Precision"
        }
      ]
    }
  },
  "origins": [
    {
      "name": "Anima",
      "breakpoints": [
        3,
        6
      ],
      "champions": [
        "Aurora",
        "Briar",
        "Fiora",
        "Illaoi",
        "Jinx"
      ],
      "summary": "After losing player combat, gain Tech plus additional Tech based on loss streak length; also gain Tech from Anima takedowns. At 100 Tech, prototype Anima Weapons."
    },
    {
      "name": "Arbiter",
      "breakpoints": [
        2,
        3
      ],
      "champions": [
        "Diana",
        "LeBlanc",
        "Leona",
        "Zoe"
      ],
      "summary": "Scribe a unique divine law with a chosen cause/effect; stronger at higher breakpoint."
    },
    {
      "name": "Bulwark",
      "breakpoints": [
        1
      ],
      "champions": [
        "Shen"
      ],
      "summary": "Summons a placeable relic that grants adjacent allies shield and attack speed."
    },
    {
      "name": "Commander",
      "breakpoints": [
        1
      ],
      "champions": [
        "Sona"
      ],
      "summary": "Sona grants a random Command Mod every 2 rounds."
    },
    {
      "name": "Dark Lady",
      "breakpoints": [
        1
      ],
      "champions": [
        "Morgana"
      ],
      "summary": "Allies take less damage from abilities; stronger while Morgana is in Dark Form."
    },
    {
      "name": "Dark Star",
      "breakpoints": [
        2,
        4,
        6,
        9
      ],
      "champions": [
        "Cho'Gath",
        "Jhin",
        "Kai'Sa",
        "Karma",
        "Lissandra",
        "Mordekaiser"
      ],
      "summary": "Summons black holes that consume low-health enemies; higher breakpoints add AD/AP and supermassive effects."
    },
    {
      "name": "Divine Duelist",
      "breakpoints": [
        1
      ],
      "champions": [
        "Fiora"
      ],
      "summary": "Tactician heals for a portion of player damage dealt from winning; Fiora always wins 1v1 duels."
    },
    {
      "name": "Doomer",
      "breakpoints": [
        1
      ],
      "champions": [
        "Vex"
      ],
      "summary": "Marks enemies with Doom; first hit consumes Doom and steals AD/AP for strongest Vex."
    },
    {
      "name": "Eradicator",
      "breakpoints": [
        1
      ],
      "champions": [
        "Jhin"
      ],
      "summary": "Enemies have less Armor and Magic Resist."
    },
    {
      "name": "Factory New",
      "breakpoints": [
        1
      ],
      "champions": [
        "Graves"
      ],
      "summary": "After combat, open an armory to buy a permanent upgrade for strongest Graves."
    },
    {
      "name": "Galaxy Hunter",
      "breakpoints": [
        1
      ],
      "champions": [
        "Zed"
      ],
      "summary": "Zed gains bonus AD while at least one clone is alive; obtained from Invader Zed augment."
    },
    {
      "name": "Gun Goddess",
      "breakpoints": [
        1
      ],
      "champions": [
        "Miss Fortune"
      ],
      "summary": "Miss Fortune chooses between Conduit, Challenger, or Replicator mode and gets a mode-specific ability."
    },
    {
      "name": "Mecha",
      "breakpoints": [
        3,
        4,
        6
      ],
      "champions": [
        "Aurelion Sol",
        "The Mighty Mech",
        "Urgot"
      ],
      "summary": "Mechas can transform into ultimate form, take 2 slots, count twice for trait, and gain bonus Health."
    },
    {
      "name": "Meeple",
      "breakpoints": [
        3,
        5,
        7,
        10
      ],
      "champions": [
        "Bard",
        "Corki",
        "Fizz",
        "Gnar",
        "Meepsie",
        "Poppy",
        "Rammus",
        "Veigar"
      ],
      "summary": "Meeps empower Meeple abilities; higher breakpoints add cloning and MeepLords."
    },
    {
      "name": "N.O.V.A.",
      "breakpoints": [
        2,
        5
      ],
      "champions": [
        "Aatrox",
        "Akali",
        "Caitlyn",
        "Kindred",
        "Maokai"
      ],
      "summary": "N.O.V.A. units trigger unique ally power surges after several seconds; at 5, gain a Striker selector."
    },
    {
      "name": "Oracle",
      "breakpoints": [
        1
      ],
      "champions": [
        "Tahm Kench"
      ],
      "summary": "Tahm Kench grants a reward every 3 rounds."
    },
    {
      "name": "Party Animal",
      "breakpoints": [
        1
      ],
      "champions": [
        "Blitzcrank"
      ],
      "summary": "Blitzcrank becomes untargetable and repairs Health once per combat after dropping low."
    },
    {
      "name": "Primordian",
      "breakpoints": [
        2,
        3
      ],
      "champions": [
        "Bel'Veth",
        "Briar",
        "Rek'Sai"
      ],
      "summary": "Spawn Swarmlings from damage dealt/taken; higher breakpoint adds more spawns and a random 1- or 2-cost each round."
    },
    {
      "name": "Psionic",
      "breakpoints": [
        2,
        4
      ],
      "champions": [
        "Gragas",
        "Master Yi",
        "Pyke",
        "Sona",
        "Viktor"
      ],
      "summary": "Gain Psionic items that can go on any ally; at 4, the items gain extra effects on Psionic holders."
    },
    {
      "name": "Redeemer",
      "breakpoints": [
        1
      ],
      "champions": [
        "Rhaast"
      ],
      "summary": "For each non-unique active trait, your team gains Attack Speed plus Armor/MR."
    },
    {
      "name": "Space Groove",
      "breakpoints": [
        1,
        3,
        5,
        7,
        10
      ],
      "champions": [
        "Blitzcrank",
        "Gwen",
        "Nami",
        "Nasus",
        "Ornn",
        "Samira",
        "Teemo"
      ],
      "summary": "Groovians can enter the Groove to gain Attack Speed and Health regen; higher breakpoints add stacking AD/AP and stronger effects."
    },
    {
      "name": "Stargazer",
      "breakpoints": [
        3,
        5,
        7
      ],
      "champions": [
        "Jax",
        "Lulu",
        "Nunu",
        "Talon",
        "Twisted Fate",
        "Xayah"
      ],
      "summary": "Each game uses a different constellation that empowers board hexes; examples include Serpent, Mountain, Altar, Medallion, Fountain, Boar."
    },
    {
      "name": "Timebreaker",
      "breakpoints": [
        2,
        3,
        4
      ],
      "champions": [
        "Ezreal",
        "Milio",
        "Pantheon",
        "Riven"
      ],
      "summary": "On losses gain rerolls; on wins store XP in a Temporal Core. Higher breakpoints add Attack Speed."
    }
  ],
  "classes": [
    {
      "name": "Bastion",
      "breakpoints": [
        2,
        4,
        6
      ],